{
  "eventId": "3c4d5e6f-7081-492a-b3c4-d5e6f7081920",
  "eventType": "planejamento.lote.editar.solicitado",
  "version": "1.0",
  "occurredOn": "2026-10-08T19:05:00Z",
  "correlationId": "7c9e6679-7425-40de-944b-e07fc1f90ae7",
  "tenantId": "00000000-0000-0000-0000-000000000001",
  "payload": {
    "loteId": "7c9e6679-7425-40de-944b-e07fc1f90ae7",
    "rotaId": "0d1f7a44-2b1c-4c0e-8f6a-9b3e5d7c1a20",
    "veiculoId": "3a5b7c9d-1e2f-4a6b-8c0d-2e4f6a8b0c1d",
    "motoristaId": "9f8e7d6c-5b4a-4392-8170-6f5e4d3c2b1a",
    "dataInicio": "2026-10-11T07:30:00",
    "dataFim": "2026-10-25T07:30:00",
    "diasDaSemana": [1, 2, 3, 4, 5]
  }
}
