{
  "eventId": "6f708192-a3b4-4c5d-e6f7-081920314253",
  "eventType": "planejamento.lote.criado",
  "version": "1.0",
  "occurredOn": "2026-10-08T19:00:01Z",
  "correlationId": "7c9e6679-7425-40de-944b-e07fc1f90ae7",
  "tenantId": "00000000-0000-0000-0000-000000000001",
  "payload": {
    "loteId": "7c9e6679-7425-40de-944b-e07fc1f90ae7",
    "status": "RASCUNHO",
    "rotaId": "0d1f7a44-2b1c-4c0e-8f6a-9b3e5d7c1a20",
    "veiculoId": "3a5b7c9d-1e2f-4a6b-8c0d-2e4f6a8b0c1d",
    "motoristaId": "9f8e7d6c-5b4a-4392-8170-6f5e4d3c2b1a",
    "dataInicio": "2026-10-10T08:00:00",
    "dataFim": "2026-10-24T08:00:00",
    "diasDaSemana": [1, 3, 5]
  }
}
