{
  "eventId": "b4c5d6e7-f809-41a2-b3c4-253647586970",
  "eventType": "agendamento.criado",
  "version": "1.0",
  "occurredOn": "2026-10-08T19:10:02Z",
  "correlationId": "7c9e6679-7425-40de-944b-e07fc1f90ae7",
  "tenantId": "00000000-0000-0000-0000-000000000001",
  "payload": {
    "agendamentoId": "c1d2e3f4-a5b6-4c7d-8e9f-0a1b2c3d4e5f",
    "loteId": "7c9e6679-7425-40de-944b-e07fc1f90ae7",
    "data": "2026-10-12T08:00:00",
    "rotaId": "0d1f7a44-2b1c-4c0e-8f6a-9b3e5d7c1a20",
    "veiculoId": "3a5b7c9d-1e2f-4a6b-8c0d-2e4f6a8b0c1d",
    "motoristaId": "9f8e7d6c-5b4a-4392-8170-6f5e4d3c2b1a"
  }
}
