{
  "eventId": "92a3b4c5-d6e7-4f80-1920-314253647586",
  "eventType": "planejamento.lote.cancelado",
  "version": "1.0",
  "occurredOn": "2026-10-08T19:15:01Z",
  "correlationId": "7c9e6679-7425-40de-944b-e07fc1f90ae7",
  "tenantId": "00000000-0000-0000-0000-000000000001",
  "payload": {
    "loteId": "7c9e6679-7425-40de-944b-e07fc1f90ae7",
    "quantidadeAgendamentosCancelados": 3
  }
}
